{"artifact_type":"deck_consistency_reviewer_response","deck_id":"D03","issues":[],"mandatory_checks":{"background_consistent":true,"card_language_consistent":true,"density_spacing_consistent":true,"navigation_consistent":true,"no_reopened_p4_fidelity":true,"palette_consistent":true,"same_deck_identity":true,"section_hierarchy_consistent":true,"typography_consistent":true,"visual_treatment_consistent":true},"reviewer_recommendation":"pass","schema_version":"1.1","structured_upstream_revision":null}
